,Release Date,link,title
0,"May 27, 2020",https://www.houstondynamo.com/post/2020/05/27/nwsl-announces-2020-challenge-cup-presented-pg-secret,NWSL announces 2020 Challenge Cup Presented by P&G & Secret
1,"May 26, 2020",https://www.houstondynamo.com/post/2020/05/26/national-women-s-soccer-league-allow-small-group-training,National Women’s Soccer League to Allow Small Group Training
2,"May 18, 2020",https://www.houstondynamo.com/post/2020/05/18/dynamo-excited-join-new-youth-development-platform,Dynamo Excited to Join New Youth Development Platform
3,"May 15, 2020",https://www.houstondynamo.com/post/2020/05/15/mls-and-usys-announce-strategic-partnership-offer-new-identification-opportunities,MLS and USYS Announce Strategic Partnership to Offer New Identification Opportunities for Domestic Players
4,"May 14, 2020 (16 min)",https://www.houstondynamo.com/houstondash/post/2020/05/14/kickin-it-shea-groom?autoplay=true,Kickin' It with Shea Groom
5,"May 14, 2020",https://www.houstondynamo.com/houstondash/post/2020/05/14/houston-dash-sign-forward-bridgette-andrzejewski,Houston Dash sign forward Bridgette Andrzejewski
