,Date_Added,Release_Date,link,team,title
0,"June 08, 2020","June 5, 2020",https://www.newyorkredbulls.com/post/2020/06/05/adolfo-el-tren-valencia-we-had-handful-players-gave-us-opportunity-have-good-team,newyorkredbulls,"Adolfo ""El Tren"" Valencia Reflects on Time with New York"
1,"June 08, 2020","June 4, 2020",https://www.newyorkredbulls.com/post/2020/06/04/meet-our-homegrown-hero-tara-wagner,newyorkredbulls,"Meet Our Homegrown Hero, Tara Wagner"
2,"June 08, 2020","June 4, 2020",https://www.newyorkredbulls.com/post/2020/06/04/major-league-soccer-clubs-return-full-team-training,newyorkredbulls,Major League Soccer Clubs to Return to Full Team Training
3,"June 08, 2020","June 3, 2020",https://www.newyorkredbulls.com/post/2020/06/03/new-york-red-bulls-announce-youth-programs-partnership-toms-river-futbol-club,newyorkredbulls,Red Bulls announce Youth Partnership with Toms River Futbol Club
4,"June 08, 2020","May 30, 2020",https://www.newyorkredbulls.com/post/2020/05/30/virtual-player-appearance-pres-tcl-past-present-panel-clint-mathis,newyorkredbulls,"VPA, pres. by TCL: Past & Present Panel with Clint Mathis"
